[
  {
    "id": "5b0e3c2a-8f1d-4e6b-9a7c-2d4f6e8a0b1c",
    "entity_id": "0c9a8b7d-6e5f-4a3b-9c2d-1e0f9a8b7c6d",
    "source": "import:csv:sparebank1",
    "source_ref": "statement-2010-01.csv",
    "content_hash": "9f2c4e6a8b0d1f3a5c7e9b1d3f5a7c9e1b3d5f7a9c1e3b5d7f9a1c3e5b7d9f1a",
    "recorded_at": "2026-11-02T08:15:30.125Z",
    "batch_id": "batch_2026-11-02T08:15:29Z_statement-2010-01",
    "file_hash": "4d6f8a0c2e4b6d8f0a2c4e6b8d0f2a4c6e8b0d2f4a6c8e0b2d4f6a8c0e2b4d6f",
    "reader": "finance.csv.sparebank1/2"
  },
  {
    "id": "7e1f2a3b-4c5d-4e6f-8a9b-0c1d2e3f4a5b",
    "entity_id": "1d0b9c8e-7f6a-4b5c-8d3e-2f1a0b9c8d7e",
    "source": "connector:actual",
    "source_ref": "txn/88412",
    "content_hash": "b1d3f5a7c9e1b3d5f7a9c1e3b5d7f9a1c3e5b7d9f1a3c5e7b9d1f3a5c7e9b1d3",
    "recorded_at": "2026-11-02T08:20:00.000Z",
    "batch_id": null,
    "file_hash": null,
    "reader": null
  }
]
